name,country,region,state,varietal,price,description,merchant,address
Frey Vineyards Organic Pinot Noir,United States,Mendocino County,California,Pinot Noir,15.99,A light and crisp Pinot Noir that shines as a cocktail wine or paired with spicy cuisine and fresh seafood. Aromas of plum and flavors of berry and spice are followed by a smooth floral finish.,Gary's Wayne,"1308 NJ-23, Wayne, NJ 07470, USA"
Frey Vineyards Organic Sauvignon Blanc,United States,Mendocino County,California,Sauvignon Blanc,11.99,,Gary's Wayne,"1308 NJ-23, Wayne, NJ 07470, USA"
Frey Vineyards Organic Zinfandel,United States,Mendocino County,California,Zinfandel,13.99,,Gary's Wayne,"1308 NJ-23, Wayne, NJ 07470, USA"
Frico Lambrusco,Italy,Lambrusco,Emilia Romagna,"Lambrusco Grasparossa, Salamino, Maestri",12.99,"Lambrusco is the quintessential sparkling aperitivo of the Emilia Romagna area of Italy and a great pre-dinner start to every occasion. Frico Lambrusco brings this central Italian wine tradition to life in a can! This Lambrusco is vibrant, fresh with a kiss of sweetness and a wonderful tart finish.",Gary's Wayne,"1308 NJ-23, Wayne, NJ 07470, USA"
Frog's Leap Cabernet Sauvignon,United States,Napa Valley,California,Cabernet Sauvignon,59.99,"Powerful and rich with luscious blackcurrant compote, wood smoke, cedar and leather. Grippy tannins and wonderfully balanced toasty oak leads to a delightful finish.",Gary's Wayne,"1308 NJ-23, Wayne, NJ 07470, USA"
Frog's Leap Zinfandel,United States,Napa Valley,California,Zinfandel,15.99,A Zinfandel that draws its power from sophistication instead of raw alcohol content. Made in the classic field blend style including significant portions of Petite Sirah and Carignan.,Gary's Wayne,"1308 NJ-23, Wayne, NJ 07470, USA"
Frontera Cabernet Sauvignon/Merlot,Chile,Central Valley,NA,"Cabernet Sauvignon, Merlot",8.99,,Gary's Wayne,"1308 NJ-23, Wayne, NJ 07470, USA"
Frontera Malbec,Argentina,NA,Cuyo,Malbec,8.99,"Exhibits a deep, dark purple-red color leading to a bouquet of fresh red fruits folded with coffee notes. The palate is highlighted by mouth-filling black cherry and dark plum flavors, elegantly wrapped with subtle spice and velvety, gentle tannins.",Gary's Wayne,"1308 NJ-23, Wayne, NJ 07470, USA"
Frontera Merlot,Chile,Central Valley,NA,Merlot,8.99,"Deep red with great intensity. On the nose, the wine shows delicious hints of plums and herbs. This Merlot reveals hints of chocolate and spice, while integrating perfectly with the dark fruit flavors.",Gary's Wayne,"1308 NJ-23, Wayne, NJ 07470, USA"
Frontera Pinot Grigio,Chile,Central Valley,NA,Pinot Grigio,8.99,,Gary's Wayne,"1308 NJ-23, Wayne, NJ 07470, USA"
Fundacao Eugenio De Almeida E A,Portugal,Alentejo,NA,Aragonez,8.99,,Gary's Wayne,"1308 NJ-23, Wayne, NJ 07470, USA"
Gaja Costa Russi,Italy,Piedmont,NA,Nebbiolo,449.99,,Gary's Wayne,"1308 NJ-23, Wayne, NJ 07470, USA"
Gaja Da Gromis Barolo,Italy,Barolo,Piedmont,Nebbiolo,99.99,,Gary's Wayne,"1308 NJ-23, Wayne, NJ 07470, USA"
Gaja Idda Etna Rosso,Italy,Etna Rosso,Sicily,Nerello Mascalese,49.99,"Etna is not just a volcano: it is a mountain that originated over hundreds of thousands of years of lava eruptions. The Sicilians attribute a female nature to it: a strict yet generous mother, which is why they call her ‘IDDA,’ meaning ‘SHE’ in the Sicilian dialect. IDDA is pure energy, it is land where every fruit ripens with many different nuances.

IDDA Etna Rosso 2017 is the inaugural vintage from the newly formed alliance between the Gaja and Graci families. A venture founded to explore the southern slope of Mount Etna, with the purpose of searching for vineyards that express elegance and complexity.",Gary's Wayne,"1308 NJ-23, Wayne, NJ 07470, USA"
Gaja Sito Moresco,Italy,Langhe,Piedmont,"Nebbiolo, Barbera, Merlot, Cabernet Sauvignon",54.99,,Gary's Wayne,"1308 NJ-23, Wayne, NJ 07470, USA"
Gaja Sori San Lorenzo,Italy,Piedmont,NA,Nebbiolo,449.99,,Gary's Wayne,"1308 NJ-23, Wayne, NJ 07470, USA"
Galerie Naissance Napa Valley Sauvignon Blanc,United States,Napa Valley,California,Sauvignon Blanc,28.99,"The Galerie collection began with Naissance (French for “birth” or “beginning”), a seamless blend of Old World and New crafted from Napa Valley Sauvignon Blanc. This flagship wine layers the citrus and mineral notes of the Loire Valley with the peach and tropical fruit characteristics of Napa Valley. Careful vineyard selection and farming preserve fresh acidity and some of the variety’s grassy characteristics, creating a complex, modern wine with international appeal.",Gary's Wayne,"1308 NJ-23, Wayne, NJ 07470, USA"
Galerie PNV Riesling,United States,Napa Valley,California,Riesling,124.99,,Gary's Wayne,"1308 NJ-23, Wayne, NJ 07470, USA"
Gallica Cabernet Sauvignon,United States,Napa Valley,California,Cabernet Sauvignon,158.99,Gallica’s flagship is farmed organically in Oakville at eight hundred to fourteen hundred feet. The blend is three-quarters Cabernet Sauvignon with Cabernet Franc. and the wine spent twenty months in French oak.,Gary's Wayne,"1308 NJ-23, Wayne, NJ 07470, USA"
Gatinois Champagne Tradition Grand Cru Brut,France,Champagne,NA,"Sparkling, Pinot Noir, Chardonnay, Champagne",47.99,"A focused rosé, with a fine and creamy bead, featuring ripe and aromatic sun-dried black cherry and toasted raisin bread notes, layered with accents of preserved lemon, almond skin and fleur de sel. Offers a fresh, well-cut finish.",Gary's Wayne,"1308 NJ-23, Wayne, NJ 07470, USA"
Gaujal Saint Bon Picpoul De Pinet Cuvee Dames,France,Picpoul De Pinet,Languedoc Roussillon,Picpoul,10.99,,Gary's Wayne,"1308 NJ-23, Wayne, NJ 07470, USA"
Gaze Wine Cocktail Blueberry Pom Moscato,United States,NA,California,NA,5.99,,Gary's Wayne,"1308 NJ-23, Wayne, NJ 07470, USA"
Gaze Wine Cocktail Coconut Moscato Chardonnay,United States,NA,California,"Chardonnay, Moscato",5.99,,Gary's Wayne,"1308 NJ-23, Wayne, NJ 07470, USA"
Georges Descombes Brouilly,France,Brouilly,Beaujolais,Gamay,29.99,,Gary's Wayne,"1308 NJ-23, Wayne, NJ 07470, USA"
Georges Duboeuf Beaujolais Villages,France,Beaujolais,Burgundy,Gamay,11.99,"An intense brilliant cherry color with purplish tints. Complex nose with red and black aromas of raspberries, red and black currants. A smooth wine with fine tannins, harmonious and complete.",Gary's Wayne,"1308 NJ-23, Wayne, NJ 07470, USA"
Georges Duboeuf Macon Villages Chardonnay,France,Burgundy,NA,"Chardonnay, Gamay",12.99,,Gary's Wayne,"1308 NJ-23, Wayne, NJ 07470, USA"
Gerard Bertrand Chateau L Hospitalet Grand Vin,France,La Clape,Languedoc Roussillon,"Grenache, Cinsault, Syrah",39.99,,Gary's Wayne,"1308 NJ-23, Wayne, NJ 07470, USA"
Gerard Boulay Sancerre Monts Damnes,France,Sancerre,Loire Valley,Sauvignon Blanc,58.99,,Gary's Wayne,"1308 NJ-23, Wayne, NJ 07470, USA"
Ghost Block Cabernet Sauvignon,United States,Napa Valley,California,Cabernet Sauvignon,64.99,"The structure & body is lengthened in your mouth by the well-integrated oak notes that frame this wine. The soft and silky tannins allow for a long-lasting finish, making this wine friendly and attractive to every type of winedrinker!",Gary's Wayne,"1308 NJ-23, Wayne, NJ 07470, USA"
Gia Langhe Rosso Red Blend,Italy,Langhe,Piedmont,"Barbera, Dolcetto, Nebbiolo",17.99,,Gary's Wayne,"1308 NJ-23, Wayne, NJ 07470, USA"
Giacomo Borgogno & Figli Dolcetto d'Alba,Italy,Piedmont,NA,Dolcetto,19.99,"Fresh and fruity notes of an easy-to-drink, fragrant and elegant wine",Gary's Wayne,"1308 NJ-23, Wayne, NJ 07470, USA"
Giacomo Borgogno Barbera D Alba,Italy,Alba,NA,"Barbera, Dolcetto",22.99,"Fresh acidity and spicy notes of an easy-to-drink, fragrant, unique and elegant wine.",Gary's Wayne,"1308 NJ-23, Wayne, NJ 07470, USA"
Giacomo Conterno Monfortino,Italy,Barolo,Piedmont,Nebbiolo,2199.99,,Gary's Wayne,"1308 NJ-23, Wayne, NJ 07470, USA"
Giesen Sauvignon Blanc,New Zealand,Marlborough,NA,Sauvignon Blanc,11.99,"Pale yellow color with green hues. The aroma is fresh and vibrant with a base of rich tropical fruit but dominated especially when young, by fresh lime and lemongrass aromas as well as a fresh herb note. The palate shows a lovely fruit weight on the mid palate with flavors reminiscent of gooseberry and citrus and this is surrounded by a juicy, pure acidity giving the wine it's zesty exuberance with a fresh, dry finish",Gary's Wayne,"1308 NJ-23, Wayne, NJ 07470, USA"
Gilbert Picq & Ses Fils Chablis,France,Chablis,Burgundy,Chardonnay,20.99,"Flinty minerality, green apple, and grapefruit define this nervy Chablis.",Gary's Wayne,"1308 NJ-23, Wayne, NJ 07470, USA"
Gini Organic Soave Classico,Italy,Soave,Veneto,Garganega,14.99,,Gary's Wayne,"1308 NJ-23, Wayne, NJ 07470, USA"
Giovanni Rosso Vigna Rionda,Italy,Barolo,Piedmont,Nebbiolo,429.99,,Gary's Wayne,"1308 NJ-23, Wayne, NJ 07470, USA"
Girard Cabernet Sauvignon Napa Valley,United States,Napa Valley,California,Cabernet Sauvignon,28.99,,Gary's Wayne,"1308 NJ-23, Wayne, NJ 07470, USA"
Girard Chardonnay Russian River Valley,United States,Russian River Valley,California,Chardonnay,22.99,"On the nose this wine reveals oak toast, nectarine and ripe pear aromas. The palate is endowed with integrated oak structure, hints of vanilla cream, lemon zest, and baked apples.",Gary's Wayne,"1308 NJ-23, Wayne, NJ 07470, USA"
Girardin Chassagne Montrachet 1er Cru Morgeot,France,Chassagne Montrachet,Burgundy,Chardonnay,71.99,Morgeot is situated near – and named for – the Abbaye de Morgeot at the southern end of Chassagne-Montrachet village.,Gary's Wayne,"1308 NJ-23, Wayne, NJ 07470, USA"
Girardin Pommard Vv,France,Pommard,Burgundy,Pinot Noir,59.99,,Gary's Wayne,"1308 NJ-23, Wayne, NJ 07470, USA"
Girardin Volnay Vielles Vignes,France,Volnay,Burgundy,Pinot Noir,48.99,,Gary's Wayne,"1308 NJ-23, Wayne, NJ 07470, USA"
Giulio Straccali Chianti,Italy,Chianti,NA,Sangiovese,9.99,,Gary's Wayne,"1308 NJ-23, Wayne, NJ 07470, USA"
Glen Ellen Reserve Cabernet Sauvignon,United States,NA,California,Cabernet Sauvignon,7.99,,Gary's Wayne,"1308 NJ-23, Wayne, NJ 07470, USA"
Glen Ellen Reserve Chardonnay,United States,NA,California,Chardonnay,7.99,,Gary's Wayne,"1308 NJ-23, Wayne, NJ 07470, USA"
Glen Ellen Reserve Merlot,United States,Central Coast,California,Merlot,7.99,,Gary's Wayne,"1308 NJ-23, Wayne, NJ 07470, USA"
Glen Ellen Reserve Pinot Grigio,United States,NA,California,Pinot Grigio,7.99,,Gary's Wayne,"1308 NJ-23, Wayne, NJ 07470, USA"
Go Figure Lot 66 Sonoma County Zinfandel,United States,Sonoma County,California,Zinfandel,22.99,"Candied cherry and milk chocolate aromas jump out in front. This medium bodied Zin is quite delicate and soft, featuring typical Zin flavors of rich, ripe fruit.",Gary's Wayne,"1308 NJ-23, Wayne, NJ 07470, USA"
Go Figure Lot 67 Red Blend Sierra Foothills,United States,Sierra Foothills,California,"Tempranillo, Barbera, Grenache",19.99,,Gary's Wayne,"1308 NJ-23, Wayne, NJ 07470, USA"
Gobelsburg Cistercien Rose,Austria,Kamptal,Niederosterreich,Rose,15.99,The charm of Austria.,Gary's Wayne,"1308 NJ-23, Wayne, NJ 07470, USA"
Gobelsburg Kamptal Gruner Veltliner,Austria,Kamptal,Niederosterreich,Gruner Veltliner,12.99,"Extremely fragrant with whiffs of juicy mirabelle plum
and physalis. So seductive and openly expressive with a pleasant filigree
touch. Compact yet lively and robust. Fine stone fruit notes. Layers of
subtle undertones and a nice racy finish.",Gary's Wayne,"1308 NJ-23, Wayne, NJ 07470, USA"
Godiva Dark Chocolate Truffles,NA,NA,NA,NA,5.99,,Gary's Wayne,"1308 NJ-23, Wayne, NJ 07470, USA"
Golan Heights Winery Hermon Mount Hermon Red,Israel,NA,NA,Red Blend,9.99,,Gary's Wayne,"1308 NJ-23, Wayne, NJ 07470, USA"
Golan Heights Winery Mount Hermon White Galilee,Israel,NA,NA,"Chardonnay, Sauvignon Blanc, Viognier",9.99,"Bright melon, citrus, floral, guava and green apple characters. The highest quality area within the appellation is the Golan Heights, the coolest region in Israel.",Gary's Wayne,"1308 NJ-23, Wayne, NJ 07470, USA"
Goose Bay Pinot Noir,New Zealand,Marlborough,NA,Pinot Noir,21.99,"Tasting notes: Aromas of raspberry, red cherry, strawberry, and light oak. Strawberry, cherry and other berry flavors on the palate. Good up front and middle palate with a soft finish. Very good length.

Production notes: Grapes were crushed and placed into small One Ton containers allowing the yeast to slowly ferment the wine over a four to five week period. Post ferment soaking is allowed for about two weeks to obtain further extraction.

Special points: Mevushal, Kosher for Passover, Vegan",Gary's Wayne,"1308 NJ-23, Wayne, NJ 07470, USA"
Goose Bay Sauvignon Blanc,New Zealand,Marlborough,NA,Sauvignon Blanc,16.99,"Tasting notes: A vibrant, crisp Sauvignon blanc with a bouquet that includes Gooseberries and lush tropical fruit and a palate including ripe Gooseberries, green gage plums, and tropical fruits with a slight hint of oak. 

Production notes: The grapes are crushed and once pressed the juice is allowed to settle for two days. The juice is then flash pasteurised and placed in a tank containing French oak. It is fermented very cool which takes about 4-6 weeks to complete. Racked off its rough lee's it is allowed to age for a further four months.

Special points: Mevushal, Kosher for Passover, vegan",Gary's Wayne,"1308 NJ-23, Wayne, NJ 07470, USA"
Gosset Champagne Brut Excellence,France,Champagne,Champagne,"Sparkling, Champagne",37.99,"With a clear, bright, pale-yellow gold color, and a nose that reveals yellow fruits such as apricots, peaches and dried fruit, this cuvée is ideally suited to be enjoyed in the summer months.

“A harmonious and pleasant cuvée made to be an apéritif.” Jean-Pierre Mareigner, Cellarmaster",Gary's Wayne,"1308 NJ-23, Wayne, NJ 07470, USA"
Gosset Champagne Grand Brut Rose,France,Champagne,Champagne,"Champagne, Sparkling",69.99,"The Grand Brut Rosé is a soft hue of salmon pink with a few ruby-cherry reflections. The nose is clearly marked by strawberries. Well-structured with a constant tension between freshness and fruity roundness, the wine is dominated by a red pulpy fruit — perhaps wild strawberry (cream or as a coulis) — giving a soft, coated sensation. It is round with a beautifully fresh finish.

“This is almost a vintage. Indeed, I added just a very little amount of reserve wines. The low dosage gives a nice balance. The red wines from Bouzy and Ambonnay are in perfect balance with the majority of the Chardonnay.” Jean-Pierre Mareigner, Cellarmaster",Gary's Wayne,"1308 NJ-23, Wayne, NJ 07470, USA"
Gota Bergamota,Portugal,Dao,NA,"Touriga Nacional, Tinta Roriz, Jaen, Alfrocheiro",14.99,,Gary's Wayne,"1308 NJ-23, Wayne, NJ 07470, USA"
Goulee Cos d'Estournel,France,Saint Estephe,Bordeaux,"Cabernet Sauvignon, Merlot",34.99,,Gary's Wayne,"1308 NJ-23, Wayne, NJ 07470, USA"
Govino Dishwasher Safe 16oz Glasses 4-Pack,NA,NA,NA,NA,15.99,"Shatterproof, reusable and ultimately recyclable. Govino invites you to join us in eliminating the waste caused by single-use plastic, one Govino at a time.

Revered by winemakers and sommeliers. 
Established 2008 in Napa Valley...
Swirled around the world ever since.

go anywhere. govino.",Gary's Wayne,"1308 NJ-23, Wayne, NJ 07470, USA"
Graffito Cabernet Franc,Argentina,Mendoza,NA,Cabernet Franc,24.99,"Jimena believes that good winemaking is simple winemaking. It starts in the vineyard with quality grapes. Beyond this, she believes in 3 key principles to make great wine: know-how, obsession for details, and above all passion.",Gary's Wayne,"1308 NJ-23, Wayne, NJ 07470, USA"
Graham's Quinta Dos Malvedos,Portugal,Port,NA,NA,59.99,,Gary's Wayne,"1308 NJ-23, Wayne, NJ 07470, USA"
Graham's Six Grapes Reserve Port,Portugal,Porto,NA,NA,6.99,"Six Grapes has a seductive, rich aroma of ripe plums, cherries and dark chocolate notes. On the palate it's complex, with an excellent structure and a long, lingering finish. Six Grapes is one of Graham's original Port blends--it is a very full-bodied, luscious wine drawn from the same vineyards as Graham's Vintage Ports. Blended from two or three years' harvests, the wine is an average of five to six years old when it is lightly filtered and bottled.",Gary's Wayne,"1308 NJ-23, Wayne, NJ 07470, USA"
Graham's Tawny Port 10 Year,Portugal,Porto,NA,NA,26.99,Graham's 10 Years Old Tawny Port is a tribute to craftsmanship. It epitomizes the passion for excellence and precision that is at the heart of every one of Graham's handmade Tawny Ports. After a decade of care and slow oak-maturation this wine is a wonderful example of the complex flavours of Tawny Port. This is a Port wine for those who appreciate quality in every detail.,Gary's Wayne,"1308 NJ-23, Wayne, NJ 07470, USA"
Graham's Vintage Port,Portugal,Douro,NA,Touriga Nacional,89.99,,Gary's Wayne,"1308 NJ-23, Wayne, NJ 07470, USA"
Grahams LBV Port 2014,Portugal,Douro,NA,NA,19.99,,Gary's Wayne,"1308 NJ-23, Wayne, NJ 07470, USA"
Grahams Vintage Port,NA,NA,NA,NA,124.99,"Wine Advocate (Parker): 95 ""With a big eucalyptus note up front, this is elegant in the mid-palate with controlled tannins. Sweet and easy in some ways, this is readily approachable now, perhaps not at peak, but more expressive than the relatively brooding Dow's, also reviewed. The hint of caramel and raisins mixed with sugar makes this irresistible. It is sexy and intriguing.""",Gary's Wayne,"1308 NJ-23, Wayne, NJ 07470, USA"
Grand Finale Mt Brave,United States,Napa Valley,California,Cabernet Sauvignon,149.99,"The Grand Finale idea came to fruition when, after winning one of the Barrel Lots, Gary approached the winemaker to see if they would be willing to add a bit of wine from another of their most favorite barrels to the leftover Barrel Lot and bottle a few cases for us under the “Grand Finale” label. The final products are representative of the finest wine from the winemakers and a taste of what Premier Napa Valley wines are all about.. AND at a mere fraction of the cost!",Gary's Wayne,"1308 NJ-23, Wayne, NJ 07470, USA"
Grand Finale Vineyard 7 & 8,United States,Napa Valley,California,Cabernet Sauvignon,249.99,"The Grand Finale idea came to fruition when, after winning one of the Barrel Lots, Gary approached the winemaker to see if they would be willing to add a bit of wine from another of their most favorite barrels to the leftover Barrel Lot and bottle a few cases for us under the “Grand Finale” label. The final products are representative of the finest wine from the winemakers and a taste of what Premier Napa Valley wines are all about.. AND at a mere fraction of the cost!",Gary's Wayne,"1308 NJ-23, Wayne, NJ 07470, USA"
Grand Puy Lacoste,France,Pomerol,Bordeaux,"Cabernet Sauvignon, Merlot",89.99,,Gary's Wayne,"1308 NJ-23, Wayne, NJ 07470, USA"
Grattamacco Bolgheri Superiore,Italy,Bolgheri,Tuscany,"Cabernet Sauvignon, Merlot, Sangiovese",67.99,"Grattamacco’s Bolgheri Rosso Superiore is iconic in Bolgheri, Italy, and beyond. The flagship wine of the estate, this was the second important wine to come from the Bolgheri area following Sassicaia.",Gary's Wayne,"1308 NJ-23, Wayne, NJ 07470, USA"
Grey Wacke Sauvignon Blanc,New Zealand,Marlborough,NA,Sauvignon Blanc,18.99,"A musky fusion of sweet scented fruits - nectarines, peaches and nashi pears with a dash of orange zest - intermingled with a floral perfume reminiscent of star jasmine and
citrus blossom. A generous palate with citrus and cassis flavours, deliciously ripe and succulent, finishing with that classic Marlborough zing. Fruit was sourced from various prime vineyard sites in Marlborough’s Southern Valleys and the central Wairau Plains, specifically in Woodbourne, Renwick and Rapaura. Soil types vary from the young alluvial soils of Rapaura and Renwick, which contain high proportions of New Zealand’s ubiquitous greywacke river stones, to the older and denser clay-loams of the Southern Valleys. The majority of the vineyards were trained using the divided Scott Henry canopy management system, with the balance on a two- or three-cane VSP (vertical shoot positioning) trellis. Sauvignon blanc was harvested largely by machine during the cool (often cold) night-time conditions. Fruit was harvested directly into half-tonne bins, which were tipped directly into a tank press. The grapes were pressed relatively lightly and the resulting juice was cold-settled prior to fermentation. The juice was fermented in stainless steel tanks, primarily
using cultured yeast with a cool, slow fermentation. A portion was allowed to undergo spontaneous indigenous yeast fermentation using slightly warmer fermentation regimes.
All individual vineyard batches were left on lees and kept separate until late July, when the blend was assembled.",Gary's Wayne,"1308 NJ-23, Wayne, NJ 07470, USA"
Grgich Hills Cabernet Sauvignon,United States,Napa Valley,California,Cabernet Sauvignon,59.99,,Gary's Wayne,"1308 NJ-23, Wayne, NJ 07470, USA"
Grgich Hills Chardonnay,United States,Napa Valley,California,Chardonnay,35.99,"The wine doesn’t undergo malolactic fermentation, preserving its natural acidity. Fermented and aged for ten months in French oak. 

Intense white peach, pear tart and pineapple scents with touches of honeysuckle, struck flint, pie crust and honeycomb. Medium-bodied with fantastic tension and loads of citrus and tropical layers, it has a satiny texture and finishes with great length.",Gary's Wayne,"1308 NJ-23, Wayne, NJ 07470, USA"
Groth Cabernet Sauvignon Oakville,United States,Napa Valley,California,Cabernet Sauvignon,49.99,"This Cabernet Sauvignon shows off a beautiful dark cherry color in the glass with aroma notes of plums, dried cherries, and toasted hazelnuts. The mouthfeel is round and juicy with firm full tannins, rich fruit flavors of huckleberry and a dried cherry sweetness fade into the warm spicy finish with hints of blackberry.",Gary's Wayne,"1308 NJ-23, Wayne, NJ 07470, USA"
Groth Cabernet Sauvignon Rsv Oakville Napa Valley,United States,Napa Valley,California,Cabernet Sauvignon,129.99,"This wine is sourced from a unique block in the heart of the appellation and the producer's 165-acre estate, rich in sedimentary rock fragments of quartz and fossils. It's lush and soft on the palate, with leather, ripe red berry and cassis flavors. The tannins are strong and wrapped tenaciously around the fruit, requiring further time in bottle; drink 2020–2028",Gary's Wayne,"1308 NJ-23, Wayne, NJ 07470, USA"
Grounded By Josh Phelps Sauvignon Blanc,United States,Santa Barbara And Monterey Counties,California,Sauvignon Blanc,12.99,"Grounded in heritage, grounded in soil, grounded in simplicity. The Grounded by Josh Phelps wines are a testament to Josh's connections with growers throughout his home state.",Gary's Wayne,"1308 NJ-23, Wayne, NJ 07470, USA"
Grounded Wine Co. Landform Pinot Noir,United States,Willamette Valley,Oregon,Pinot Noir,19.99,"Through brilliant medium ruby color, the 2018 Landform Pinot Noir is a wine with a very expressive personality. Leading with compelling aromas of freshly-crushed cherry, strawberry, and raspberry. On the palate, the wine is refreshing, with a structure that is surprisingly full-bodied and seamless from start to finish. There is just enough texture to provide a sense of vibrant energy, which culminates in a lively crescendo highlighted by fresh cherry and strawberry flavors.",Gary's Wayne,"1308 NJ-23, Wayne, NJ 07470, USA"
Grounded Wine Co. Space Age Rose,United States,"Central Coast, Santa Barbara And Monterey Counties",California,"Rose, Grenache Rose",14.99,"On the night of July 20, 1969, we stared at the moon and listened to the radio chatter of the Apollo 11 astronauts. One voice boomed back to the listeners on Earth declaring, ""That's one small step for man, one giant leap for mankind."" This brand focuses on the emotions at play during the American Space Age, producing a grounded authenticity that speaks of the wine inside.

After being picked cold in the early morning hours, we follow a rigorous program modeled after the techniques used to produce our favorite southern-France rosés. Whole clusters go directly to into the press upon arrival, and the delicate juice is slowly fermented at ultra-low temperatures en route to early bottling, all in our quest to preserve maximum freshness.

With its classic pale pink “eye of the partridge color,” prized by rosé producers in Provence, the 2018 Space Age Rosé delivers an amazingly fresh, vibrant rush of bright aromas of strawberry, rose petal hibiscus and cranberry. The crisp natural acidity keeps these aromas alive and fresh on the palate and through the surprisingly long, fragrant finish.

Food Pairing:
Pan Seared Sea Bass with Fresh Lemon
Asian Citrus Salad
Herb Roasted Chicken with Thyme and Basil

Cheese Pairing:
Soft, bloomy rind cheese such as Brie or Camembert",Gary's Wayne,"1308 NJ-23, Wayne, NJ 07470, USA"
Gruet Blanc De Noirs,United States,NA,New Mexico,Sparkling,12.99,"Tasting notes: Mature, with good richness and complexity built around a core of earthy pear, spice and hazelnut flavors. Finishes with a nice dry aftertaste. Pale salmon in color, this full-bodied wine had a fine mousse and a creamy, rich texture. Complex aromas and flavors of raspberry, baked pear and cherry are complemented by a hint of toasted vanilla. The balance of fruit, minerals and crisp acidity lead to a round mouthfeel and lasting finish.

Production notes:  Bottle Aged en Tirage for a minimum of 24 months.",Gary's Wayne,"1308 NJ-23, Wayne, NJ 07470, USA"
Gruet Brut Half Bottle,United States,NA,New Mexico,Sparkling,10.99,,Gary's Wayne,"1308 NJ-23, Wayne, NJ 07470, USA"
Gruet Brut Rosé Méthode Champenoise,United States,NA,New Mexico,Sparkling,13.99,"A beautiful garnet in color, this Rosé  has a number of aromatics from simple floral notes to mouth watering strawberry all while maintaining a zesty acidity and delicate finish.",Gary's Wayne,"1308 NJ-23, Wayne, NJ 07470, USA"
