name,country,region,state,varietal,price,description,merchant,address
Champagne Tasting,France,Champagne,NA,NA,160.0,"This wine package includes the following wines:
Pol Roger Reserve Brut (48595)
H Blin Brut Champagne (37046)
Louis Rodererer Vintage Rose (24739)",Gary's Wayne,"1308 NJ-23, Wayne, NJ 07470, USA"
Chandon Blanc De Noirs,United States,NA,California,Sparkling,17.99,"Chandon Blanc de Noirs is characteristically a delicate salmon color. Wild cherry, currants and strawberries dominate both aroma and flavor.",Gary's Wayne,"1308 NJ-23, Wayne, NJ 07470, USA"
Chappellet Calesa Vineyard Chardonnay,United States,Sonoma,California,Chardonnay,48.99,"Inviting aromas of Meyer lemon, orange zest and hints of tropical flowers. On the palate, luxurious layers of brioche, melted butter and baking spices.",Gary's Wayne,"1308 NJ-23, Wayne, NJ 07470, USA"
Chappellet Mountain Cuvee,United States,Napa County,California,"Cabernet Sauvignon, Merlot, Petit Verdot, Cabernet Franc, Red Blend",28.99,"Blended from the traditional Bordeaux varietals, including our own coveted grapes, the Chappellet Mountain Cuvee Proprietor's Blend builds on our five decades of experience crafting great Napa County mountain-grown wines. Each component varietal in the cuvée contributes to nuances that complement each other. The result is a complex array of aromas and flavors that deliver pure pleasure in a glass. Made for more near-term enjoyment, this is the wine to choose when you're looking for vivid, mouthfilling fruit flavors.
Alluringly dark and spicy, this wine displays beautiful aromas of currant, cassis, sage, and thyme, as well as hints of cinnamon and clove from barrel aging. On the palate, the tannins are impeccably balanced, adding depth to the lush ripe berry flavors, with layers of cola and grenadine emerging as the wine evolves in the glass.

Blend: 44% Cabernet Sauvignon, 33% Merlot, 10% Malbec, 8% Petit Verdot, 5% Cabernet Franc",Gary's Wayne,"1308 NJ-23, Wayne, NJ 07470, USA"
Charles Smith Kung Fu Girl Riesling,United States,Columbia Valley,Washington,Riesling,10.99,"It takes an unconventional winemaker to make a totally unexpected dry Riesling. One night, Charles was eating Chinese takeout and watching a fight scene in a notorious martial arts film when he had an idea: a killer white wine made to be paired with Asian food. Just like that, Kung Fu Girl was born. And it’s been kicking ass and taking names ever since.",Gary's Wayne,"1308 NJ-23, Wayne, NJ 07470, USA"
Chase Hayne Reserve Zinfandel,United States,Napa Valley,California,Zinfandel,104.99,,Gary's Wayne,"1308 NJ-23, Wayne, NJ 07470, USA"
Chat Guillon Graves Bordeaux,France,Graves,Bordeaux,Merlot,18.99,,Gary's Wayne,"1308 NJ-23, Wayne, NJ 07470, USA"
Chat Latour Camblanes Cadillac Bordeaux,France,Cadillac,Bordeaux,Merlot,14.99,,Gary's Wayne,"1308 NJ-23, Wayne, NJ 07470, USA"
Chateau Angelus,France,Saint Emilion,Bordeaux,"Merlot, Cabernet Sauvignon",399.99,,Gary's Wayne,"1308 NJ-23, Wayne, NJ 07470, USA"
Chateau Ausone,France,Saint Emilion,Bordeaux,"Merlot, Cabernet Franc",849.99,,Gary's Wayne,"1308 NJ-23, Wayne, NJ 07470, USA"
Chateau Barde Haut,France,Bordeaux,NA,Bordeaux,36.99,,Gary's Wayne,"1308 NJ-23, Wayne, NJ 07470, USA"
Chateau Beausejour Duffau Lagarosse,France,Saint Emilion,Bordeaux,"Merlot, Cabernet Franc",79.99,,Gary's Wayne,"1308 NJ-23, Wayne, NJ 07470, USA"
Chateau Beychevelle,France,Saint Julien,Bordeaux,"Cabernet Sauvignon, Merlot, Petit Verdot, Cabernet Franc",112.99,,Gary's Wayne,"1308 NJ-23, Wayne, NJ 07470, USA"
Chateau Bourbon La Chapelle Medoc Red Bordeaux,France,Medoc,Bordeaux,"Cabernet Sauvignon, Merlot",13.99,,Gary's Wayne,"1308 NJ-23, Wayne, NJ 07470, USA"
Chateau Bourseau Lalande De Pomerol,France,Lalande De Pomerol,Bordeaux,Merlot,19.99,"Situated on a gravelly knoll in the southern part of the town of Lalande-de- Pomerol, Château Bourseau belongs to the Lalande-de-Pomerol appellation.",Gary's Wayne,"1308 NJ-23, Wayne, NJ 07470, USA"
Chateau Branaire Ducru 2015,France,Saint Julien,Bordeaux,"Cabernet Sauvignon, Merlot, Cabernet Franc, Petit Verdot",69.99,,Gary's Wayne,"1308 NJ-23, Wayne, NJ 07470, USA"
Chateau Canon La Gaffeliere,France,Saint Emilion,Bordeaux,"Merlot, Cabernet Franc, Cabernet Sauvignon",104.99,Château Canon-la-Gaffelière is owned by Comte von Neipperg. Located in the centre of the St. Émilion appellation and due south of St. Émilion town.  #2 for Wine Spectator's Top 100 Wines of 2018.,Gary's Wayne,"1308 NJ-23, Wayne, NJ 07470, USA"
Chateau Canon La Gaffeliere 3l,France,Saint Emilion,Bordeaux,"Merlot, Cabernet Franc, Cabernet Sauvignon",529.99,,Gary's Wayne,"1308 NJ-23, Wayne, NJ 07470, USA"
Chateau Castera Medoc Cru Bourgeois,France,Bordeaux,NA,Cabernet Sauvignon,21.99,,Gary's Wayne,"1308 NJ-23, Wayne, NJ 07470, USA"
Chateau Cheval Blanc,France,Saint Emilion,Bordeaux,"Merlot, Cabernet Franc, Cabernet Sauvignon",699.99,,Gary's Wayne,"1308 NJ-23, Wayne, NJ 07470, USA"
Chateau Clarke Baron Edmond De Rothschild Red Bdx,France,Bordeaux,NA,"Merlot, Rouge",44.99,,Gary's Wayne,"1308 NJ-23, Wayne, NJ 07470, USA"
Chateau Dassault,France,Saint Emilion,Bordeaux,Merlot,48.99,,Gary's Wayne,"1308 NJ-23, Wayne, NJ 07470, USA"
Chateau Dassault Saint Emilion,France,Saint Emilion,Bordeaux,"Merlot, Cabernet Franc",48.99,,Gary's Wayne,"1308 NJ-23, Wayne, NJ 07470, USA"
Chateau De Beaucastel Chateauneuf-du-Pape,France,Chateauneuf Du Pape,Southern Rhone,"Syrah, Mourvedre, Grenache, Rouge",79.99,"Youthfully reticent, but warm and polished in feel, with a large core of cassis, raspberry and cherry puree notes lying in wait for now. Threads of red licorice, warm stone and singed mesquite and cedar emerge steadily through the lengthy finish as the fruit unwinds slowly. Concentrated yet precise. Sock this away in the cellar. Grenache, Mourvèdre, Syrah, Counoise, Cinsault and others.",Gary's Wayne,"1308 NJ-23, Wayne, NJ 07470, USA"
Chateau De Fleurie Barbet,France,Fleurie,Beaujolais,Gamay,17.99,"Light ruby color with vivacious layers of flavor including raspeberry, crushed rose petals and an underlying sleek muskiness. Juicy and deep flavor but still clean and light bodied.  Ideal with roasts, lamb and white meat dishes, it can age up to ten to fifteen years in good vintages.",Gary's Wayne,"1308 NJ-23, Wayne, NJ 07470, USA"
Chateau De Haut Coulon Cadillac,France,Cadillac Côtes De Bordeaux Aop,Bordeaux,"Merlot, Cabernet Sauvignon, Petit Verdot",22.99,,Gary's Wayne,"1308 NJ-23, Wayne, NJ 07470, USA"
Chateau De La Ragotiere Seleccion Vielles Vignes Muscadet,France,Muscadet,Loire Valley,Melon De Bourgogne,13.99,"50 year old vines from a 14th century old estate,�This offering is light-bodied, dry, stony, and comes alive in the glass... it represents a terrific value for a wine of such class.�,The Wine Advocate",Gary's Wayne,"1308 NJ-23, Wayne, NJ 07470, USA"
Chateau De Lascaux Languedoc,France,Languedoc,Languedoc Roussillon,Syrah,16.99,,Gary's Wayne,"1308 NJ-23, Wayne, NJ 07470, USA"
Chateau De Pibarnon Bandol Rose,France,Bandol,Provence,Rose,27.99,,Gary's Wayne,"1308 NJ-23, Wayne, NJ 07470, USA"
Chateau De Ribebon Bordeaux Superieur,France,Bordeaux Superieur,Bordeaux,"Merlot, Cabernet Franc, Cabernet Sauvignon",10.99,"This magnificent XVIII century building is a former Lous XVI shooting loodge.  The current owners, Alain & Bernadette Aubert, have known how to preserve This exceptional historic heritage. The terrace of the chateau offers an amazing view of the Dordogne which flows beneath it and over the property of some 80 hectares, giving life to a red wine, Bordeaux Supérieur, the Chateau Ribebon.",Gary's Wayne,"1308 NJ-23, Wayne, NJ 07470, USA"
Chateau De l'Aumerade Cotes De Provence Rose,France,Cotes De Provence,Provence,"Cinsault, Grenache, Syrah",15.99,,Gary's Wayne,"1308 NJ-23, Wayne, NJ 07470, USA"
Chateau Des Bormettes l'Argentiere Rose,France,Cotes De Provence,Provence,Rose,18.99,"At harvest grapes are picked at night to maximize aromatic potential, reduce color extraction, and moderate the use of sulfur. In the cellar, the search for freshness continues.",Gary's Wayne,"1308 NJ-23, Wayne, NJ 07470, USA"
Chateau Des Capitans Julienas,France,Julienas,Beaujolais,Gamay,24.99,"Complex nose offers an array of fruits, from peach to raspberry and black currant, with a subtle touch of cinnamon. Ample structure and excellent balance will allow this wine to age in bottle quite gracefully.",Gary's Wayne,"1308 NJ-23, Wayne, NJ 07470, USA"
Chateau Du Lort Bordeaux Superieur,France,Bordeaux Superieur,Bordeaux,"Merlot, Cabernet Sauvignon",11.99,,Gary's Wayne,"1308 NJ-23, Wayne, NJ 07470, USA"
Chateau Ducru Beaucaillou,France,Saint Julien,Bordeaux,"Cabernet Sauvignon, Merlot",249.99,,Gary's Wayne,"1308 NJ-23, Wayne, NJ 07470, USA"
Chateau Faugeres,France,Saint Emilion,Bordeaux,"Cabernet Sauvignon, Merlot, Cabernet Franc",54.99,,Gary's Wayne,"1308 NJ-23, Wayne, NJ 07470, USA"
Chateau Figeac,France,Saint Emilion,Bordeaux,"Cabernet Sauvignon, Merlot, Cabernet Franc",239.99,,Gary's Wayne,"1308 NJ-23, Wayne, NJ 07470, USA"
Chateau Fortia Chateauneuf du Pape Blanc,France,Chateauneuf Du Pape,Southern Rhone,Grenache,38.99,,Gary's Wayne,"1308 NJ-23, Wayne, NJ 07470, USA"
Chateau Fuisse Pouilly Fuisse Les Combettes,France,Pouilly Fuisse,Burgundy,Chardonnay,71.99,,Gary's Wayne,"1308 NJ-23, Wayne, NJ 07470, USA"
Chateau Fuisse Pouilly Fuisse Tete de Cuvee,France,Pouilly Fuisse,Burgundy,Chardonnay,38.99,,Gary's Wayne,"1308 NJ-23, Wayne, NJ 07470, USA"
Chateau Gassier Esprit Gassier Rose,France,Cotes De Provence,Provence,"Syrah, Grenache, Cinsault, Carignan, Mourvédre, Clairette",18.99,"A light, dry rose, the nose has white flowers and peach. The mouth is light with notes of citrus fruits, berries, and a refreshing acidity on the finish.",Gary's Wayne,"1308 NJ-23, Wayne, NJ 07470, USA"
Chateau Gazin Pomerol 2016,France,Pomerol,Bordeaux,"Merlot, Cabernet Franc",94.99,,Gary's Wayne,"1308 NJ-23, Wayne, NJ 07470, USA"
Chateau Gazin Rocquencourt Pessac Leognan,France,Pessac Leognan,Bordeaux,"Cabernet Sauvignon, Merlot",29.99,,Gary's Wayne,"1308 NJ-23, Wayne, NJ 07470, USA"
Chateau Grand Puy Lacoste,France,Pauillac,Bordeaux,"Cabernet Sauvignon, Merlot, Cabernet Franc",77.99,Great value left-bank Bordeaux.  Riper fruits with good structure.,Gary's Wayne,"1308 NJ-23, Wayne, NJ 07470, USA"
Chateau Graville Lacoste Graves Blanc,France,Bordeaux,NA,"Sauvignon Blanc, Semillon, Muscadelle",16.99,"GRAPES: 75% Sémillon, 20% Sauvignon Blanc, 5% Muscadelle; 45 year-old vines
TASTING NOTES: Chateau Graville-Lacoste is distinguished by its high percentage of Semillon. It has aromas of peach, melon, wet stone, fresh cut grass and citrus. A classic footprint of Sauvignon Blanc supports the distinct richness of the Semillon. After chilling, let the bottle warm just a bit to allow the complexity to be expressed. This white is terrific with seafood, chicken, grilled vegetables or simply on its own.
PRODUCTION NOTES: Harvested in September. Vinification and aging in stainless steel for 6 months. Total production: 8,667 cases. Bottled unfiltered",Gary's Wayne,"1308 NJ-23, Wayne, NJ 07470, USA"
Chateau Greysac,France,Medoc,Bordeaux,"Merlot, Cabernet Sauvignon, Cabernet Franc, Petite Verdot",17.99,"Classified as Médoc Cru Bourgeois, Château Greysac has been a member of the elite Union des Grands Crus de Bordeaux since 1982.",Gary's Wayne,"1308 NJ-23, Wayne, NJ 07470, USA"
Chateau Greysac Half Bottle,France,Medoc,Bordeaux,"Merlot, Cabernet Sauvignon, Cabernet Franc, Petit Verdot",12.99,"Classified as Médoc Cru Bourgeois, Château Greysac has been a member of the elite Union des Grands Crus de Bordeaux since 1982.",Gary's Wayne,"1308 NJ-23, Wayne, NJ 07470, USA"
Chateau Greysac Medoc 1.5l,France,Medoc,Bordeaux,"Merlot, Cabernet Sauvignon, Cabernet Franc, Petit Verdot",35.99,"Classified as Médoc Cru Bourgeois, Château Greysac has been a member of the elite Union des Grands Crus de Bordeaux since 1982.",Gary's Wayne,"1308 NJ-23, Wayne, NJ 07470, USA"
Chateau Guiraud Le G Blanc,France,Bordeaux,Bordeaux,"Sauvignon Blanc, Semillon",19.99,,Gary's Wayne,"1308 NJ-23, Wayne, NJ 07470, USA"
Chateau Haut Bailly,France,Pessac Leognan,Bordeaux,"Cabernet Sauvignon, Merlot",103.99,,Gary's Wayne,"1308 NJ-23, Wayne, NJ 07470, USA"
Chateau Haut Bailly 1.5l,France,Pessac Leognan,Bordeaux,"Cabernet Sauvignon, Merlot, Petit Verdot, Cabernet Franc",274.99,,Gary's Wayne,"1308 NJ-23, Wayne, NJ 07470, USA"
Chateau Haut Brion,France,Pessac Leognan,Bordeaux,"Merlot, Cabernet Sauvignon, Cabernet Franc",1125.99,THREE 100 POINT RATINGS FOR THE 2005 VINTAGE!,Gary's Wayne,"1308 NJ-23, Wayne, NJ 07470, USA"
Chateau Haut Brion 2018 Pre Arrival,France,Pessac Leognan,Bordeaux,Cabernet Sauvignon,549.99,,Gary's Wayne,"1308 NJ-23, Wayne, NJ 07470, USA"
Chateau Haut Brion Blanc,France,Pessac Leognan,Bordeaux,"Sauvignon Blanc, Semillon",1965.0,,Gary's Wayne,"1308 NJ-23, Wayne, NJ 07470, USA"
Chateau Hourtou,France,Cotes De Bourg,Bordeaux,"Merlot, Malbec, Cabernet Franc, Cabernet Sauvignon",14.99,,Gary's Wayne,"1308 NJ-23, Wayne, NJ 07470, USA"
Chateau La Branne,France,Medoc,Bordeaux,"Cabernet Sauvignon, Merlot, Petit Verdot",19.99,,Gary's Wayne,"1308 NJ-23, Wayne, NJ 07470, USA"
Chateau La Chandelliere,France,Medoc,Bordeaux,"Cabernet Sauvignon, Merlot",18.99,,Gary's Wayne,"1308 NJ-23, Wayne, NJ 07470, USA"
Chateau La Conseillante,France,Pomerol,Bordeaux,"Merlot, Cabernet Franc",154.99,"Deep in colour, on the nose we find the usual traits of violets and licorice, but with notes of red berry fruit and white flowers coming through too.",Gary's Wayne,"1308 NJ-23, Wayne, NJ 07470, USA"
Chateau La Fleur Plaisance Montagne Saint Emilion,France,Montagne Saint Emilion,Bordeaux,"Merlot, Cabernet Sauvignon",19.99,,Gary's Wayne,"1308 NJ-23, Wayne, NJ 07470, USA"
Chateau La Gaffeliere,France,Saint Emilion,Bordeaux,"Merlot, Cabernet Franc",124.99,,Gary's Wayne,"1308 NJ-23, Wayne, NJ 07470, USA"
Chateau La Garde Pessac Leognan Rouge,France,Pessac Leognan,Bordeaux,Merlot,34.99,,Gary's Wayne,"1308 NJ-23, Wayne, NJ 07470, USA"
Chateau La Lagune,France,Haut Medoc,Bordeaux,"Cabernet Sauvignon, Merlot, Petit Verdot",59.99,,Gary's Wayne,"1308 NJ-23, Wayne, NJ 07470, USA"
Chateau La Mission Haut Brion,France,Pessac Leognan,Bordeaux,"Merlot, Cabernet Sauvignon, Cabernet Franc",649.99,,Gary's Wayne,"1308 NJ-23, Wayne, NJ 07470, USA"
Chateau La Mondotte,France,Saint Emilion,Bordeaux,"Merlot, Cabernet Franc",199.99,,Gary's Wayne,"1308 NJ-23, Wayne, NJ 07470, USA"
Chateau Lafaurie Peyraguey Sauternes,France,Sauternes,Bordeaux,"Semillon, Sauvignon Blanc",39.99,"At the heart of the great terroirs of the Sauternes region, Lafaurie-Peyraguey’s vineyard is located on the terrace of Sauternes gravel, just next to Château d’Yquem.",Gary's Wayne,"1308 NJ-23, Wayne, NJ 07470, USA"
Chateau Lafite Rothschild,France,Pauillac,Bordeaux,"Cabernet Sauvignon, Merlot",1549.99,,Gary's Wayne,"1308 NJ-23, Wayne, NJ 07470, USA"
Chateau Lalande Borie,France,Saint Julien,Bordeaux,"Merlot, Cabernet Sauvignon",39.99,"This Left Bank vineyard is planted to 50% Cabernet Sauvignon, 40% Merlot and 10% Cabernet Franc. The vineyard has a terroir of gravel and clay soils.",Gary's Wayne,"1308 NJ-23, Wayne, NJ 07470, USA"
Chateau Larcis Ducasse,France,Saint Emilion,Bordeaux,"Merlot, Cabernet Franc",69.99,,Gary's Wayne,"1308 NJ-23, Wayne, NJ 07470, USA"
Chateau Larose Trintaudon Haut Medoc,France,Haut Médoc,Bordeaux,"Cabernet Sauvignon, Merlot, Petit Verdot",19.99,"Beautiful dark ruby color with quite an intense bouquet bringing together aromas or red ripe berries as well as spicier vanilla notes. On the palate the wine is incredibly round with a dense tannic structure, yet not overly massive. Great freshness finished off by slight mineral undertones and a silky texture.",Gary's Wayne,"1308 NJ-23, Wayne, NJ 07470, USA"
Chateau Larroque Bordeaux Superieur,France,Bordeaux Superieur,Bordeaux,"Merlot, Cabernet Sauvignon, Cabernet Franc",12.99,"The silky, velvety attack reveals a pleasant, concentrated and well- structured wine, wine a combination of fruits pastes’ flavours, liquorice and toasted notes, and an elegant finish",Gary's Wayne,"1308 NJ-23, Wayne, NJ 07470, USA"
Chateau Latour,France,Pauillac,Bordeaux,"Cabernet Sauvignon, Merlot",1690.99,,Gary's Wayne,"1308 NJ-23, Wayne, NJ 07470, USA"
Chateau Le Gay,France,Pomerol,Bordeaux,"Merlot, Cabernet Franc",124.99,"This wine is marked by its classicism and its perfection. The color is quite deep and leads to a clear and frank nose. The Merlot, main grape-variety in this blend, perfectly expresses through elegant hints of red berry, cherry and blackberry.  The 2015 Chateau Le Gay is fresh and fruity; the palate is deep.",Gary's Wayne,"1308 NJ-23, Wayne, NJ 07470, USA"
Chateau Leoville Barton,France,Bordeaux,NA,NA,94.99,,Gary's Wayne,"1308 NJ-23, Wayne, NJ 07470, USA"
Chateau Leoville Las Cases,France,Saint Julien,Bordeaux,"Cabernet Sauvignon, Cabernet Franc, Merlot",349.99,,Gary's Wayne,"1308 NJ-23, Wayne, NJ 07470, USA"
Chateau Leoville Poyferre,France,Saint Julien,Bordeaux,"Cabernet Sauvignon, Merlot",86.99,,Gary's Wayne,"1308 NJ-23, Wayne, NJ 07470, USA"
Chateau Les Martins Blaye Cotes De Bordeaux,France,Blaye,Bordeaux,"Merlot, Cabernet Sauvignon, Malbec",11.99,,Gary's Wayne,"1308 NJ-23, Wayne, NJ 07470, USA"
Chateau Lynch Bages Pauillac,France,Pauillac,Bordeaux,"Cabernet Sauvignon, Merlot",174.99,,Gary's Wayne,"1308 NJ-23, Wayne, NJ 07470, USA"
Chateau Malartic Lagraviere,France,Pessac Leognan,Bordeaux,"Cabernet Sauvignon, Merlot, Petit Verdot, Cabernet Franc",56.99,Château Malartic-Lagravière is one of the only six classified growths both for its red and white. Its wines are well known all over the world amongst the very best wines in the Pessac-Léognan appellation.,Gary's Wayne,"1308 NJ-23, Wayne, NJ 07470, USA"
Chateau Malbat Bordeaux,France,Bordeaux,Bordeaux,"Bordeaux, Merlot, Cabernet Sauvignon, Cabernet Franc, Rouge",8.99,,Gary's Wayne,"1308 NJ-23, Wayne, NJ 07470, USA"
Chateau Margaux,France,Margaux,Bordeaux,"Cabernet Sauvignon, Merlot, Cabernet Franc, Petit Verdot",1999.99,,Gary's Wayne,"1308 NJ-23, Wayne, NJ 07470, USA"
Chateau Montaud Rose Bag In Box,France,Cotes De Provence,Provence,Rose,25.99,,Gary's Wayne,"1308 NJ-23, Wayne, NJ 07470, USA"
Chateau Montlabert Saint Emilion,France,Saint Emilion,Bordeaux,"Merlot, Cabernet Franc",39.99,,Gary's Wayne,"1308 NJ-23, Wayne, NJ 07470, USA"
Chateau Montlandrie Cotes De Castillon,France,Castillon,Bordeaux,"Merlot, Cabernet Franc, Cabernet Sauvignon",26.99,,Gary's Wayne,"1308 NJ-23, Wayne, NJ 07470, USA"
Chateau Montrose 1.5L,France,Saint Estephe,Bordeaux,"Cabernet Sauvignon, Merlot, Cabernet Franc",424.99,,Gary's Wayne,"1308 NJ-23, Wayne, NJ 07470, USA"
Chateau Moulin Pontet Bordeaux,France,Bordeaux Superieur,Bordeaux,Merlot,11.99,,Gary's Wayne,"1308 NJ-23, Wayne, NJ 07470, USA"
Chateau Mouton Rothschild 1.5l,France,Pauillac,Bordeaux,"Cabernet Sauvignon, Merlot, Cabernet Franc, Petit Verdot",1649.99,,Gary's Wayne,"1308 NJ-23, Wayne, NJ 07470, USA"
Chateau Mukhrani Saperavi,Georgia,Kartli,Georgian Republic,Saperavi,19.99,"Saperavi is Georgia’s endemic varietal and has all the noble characteristics making it one of the world’s most outstanding red wines. Saperavi is a rich, varietal, fruity wine of bountiful body.",Gary's Wayne,"1308 NJ-23, Wayne, NJ 07470, USA"
Chateau Musar Musar Jeune Red Bekaa Valley Lebanon,Lebanon,Béqaa Valley,NA,"Cinsault, Syrah, Carignan, Cabernet Sauvignon",17.99,,Gary's Wayne,"1308 NJ-23, Wayne, NJ 07470, USA"
Chateau Nenin,France,Pomerol,Bordeaux,"Cabernet Franc, Cabernet Sauvignon",89.99,"According to the Delon family, Château Nenin is the epitome of a great Pomerol ""vin de garde"" (wine for laying down). It combines power and elegance, complexity and balance, purity and refi nement. The gradual increase of Cabernet Franc within the vineyards gives the wine tautness, distinction and freshness.",Gary's Wayne,"1308 NJ-23, Wayne, NJ 07470, USA"
Chateau Palmer 1.5L,France,Margaux,Bordeaux,"Cabernet Sauvignon, Merlot, Petit Verdot",759.99,,Gary's Wayne,"1308 NJ-23, Wayne, NJ 07470, USA"
Chateau Pape Clement Rouge,France,Pessac Leognan,Bordeaux,"Merlot, Cabernet Sauvignon, Petit Verdot",119.99,"A wine of good density ruby red, with brown, mahogany, biscuit hints. The beauty of the wine is revealed by its elegance rather than its full-flavor.",Gary's Wayne,"1308 NJ-23, Wayne, NJ 07470, USA"
Chateau Pavie,France,Saint Emilion,Bordeaux,"Merlot, Cabernet Franc, Cabernet Sauvignon",399.99,,Gary's Wayne,"1308 NJ-23, Wayne, NJ 07470, USA"
Chateau Pavie 1.5l,France,Saint Emilion,Bordeaux,"Cabernet Sauvignon, Merlot, Cabernet Franc",879.99,,Gary's Wayne,"1308 NJ-23, Wayne, NJ 07470, USA"
Chateau Pech De Jammes Malbec,France,Cahors,Southwest France,Malbec,24.99,,Gary's Wayne,"1308 NJ-23, Wayne, NJ 07470, USA"
Chateau Pichon Baron,France,Pauillac,Bordeaux,"Cabernet Sauvignon, Merlot",149.99,,Gary's Wayne,"1308 NJ-23, Wayne, NJ 07470, USA"
Chateau Pichon Lalande,France,Bordeaux,NA,NA,144.99,,Gary's Wayne,"1308 NJ-23, Wayne, NJ 07470, USA"
Chateau Pierrail Bordeaux,France,Bordeaux Superieur,Bordeaux,"Cabernet Franc, Merlot",17.99,"Situated on a rocky outcrop, Château du Pierrail looks over a valley in which the river Fonchotte meanders through. This small river rises in the estate and flows into a 3 hectares lake situated in a woodland in the middle of the property. This fine château of classic design, Mansart roofed, has a facade flanked by two towers. It was built in the 17th century by the Segur family on the site of an older middle ages château. From 1782, for more than a century the property was owned by the Barons de Brianson, and large portraits of the family as cavaliers are hung in the main salon of the château. Jacques Demonchaux, began to restore the property into its former glory. The 17th century Chateau, its park and vineyard became a beautiful estate of harmony and charm. He was joined by his wife, Alice Demonchaux and their son, Aurelien Demonchaux. Alice is responsible for the commercialisation of Château Pierrail wines with a network of partners world wide.",Gary's Wayne,"1308 NJ-23, Wayne, NJ 07470, USA"
Chateau Pontet Canet,France,Pauillac,Bordeaux,"Cabernet Sauvignon, Merlot, Cabernet Franc",169.99,,Gary's Wayne,"1308 NJ-23, Wayne, NJ 07470, USA"
Chateau Prieure Lichine,France,Margaux,Bordeaux,"Cabernet Sauvignon, Merlot, Cabernet Franc, Petit Verdot",62.99,"92 Points, The Wine Advocate

The 2016 Prieure-Lichine has a medium to deep garnet-purple color and a bold, intensely scented nose of warm blackcurrants, black raspberries and mulberries with hints of cedar chest, tobacco, dried herbs and iron ore. Medium-bodied, the palate has bags of class with lovely, vibrant black berries flavors and earthy sparks framed by ripe grainy tannins, finishing long and refreshing. 50% new oak barrels.",Gary's Wayne,"1308 NJ-23, Wayne, NJ 07470, USA"
Chateau Prieure Saint Flaurent,France,Bordeaux,Bordeaux,"Merlot, Cabernet Sauvignon",9.99,,Gary's Wayne,"1308 NJ-23, Wayne, NJ 07470, USA"
Chateau Puygueraud,France,Cotes De Francs,Bordeaux,"Merlot, Cabernet Franc, Malbec",18.99,,Gary's Wayne,"1308 NJ-23, Wayne, NJ 07470, USA"
Chateau Roc De Becot Saint Emilion,France,Saint Emilion,Bordeaux,Merlot,17.99,,Gary's Wayne,"1308 NJ-23, Wayne, NJ 07470, USA"
Chateau Roc De Levraut,France,Bordeaux Superieur,Bordeaux,"Cabernet Sauvignon, Cabernet Franc, Merlot",9.99,"Subtle oak, bright acidity with tastes of tart cherry, ripe blackberry, leather and a touch of chocolate.",Gary's Wayne,"1308 NJ-23, Wayne, NJ 07470, USA"
Chateau Saint Cosme Cotes Du Rhone,France,Cotes Du Rhone,Southern Rhone,"Syrah, Grenache",14.99,,Gary's Wayne,"1308 NJ-23, Wayne, NJ 07470, USA"
Chateau Saint Michelle Chardonnay Indian Wells,United States,Columbia Valley,Washington,Chardonnay,16.99,"Sourced from a select collection of vineyards in the northern Columbia Valley and noted for a distinctively rich, mouth-filling style. Washington state's founding winery. Our Indian Wells series wines showcase a signature fruit forward, mouth-filling style. Wine from this area are intensely ripe and boldly flavored. Rich and velvety, this Chardonnay is scented with pineapple and mango. Luscious flavors of caramel and butterscotch intermingle with tropical fruit, leading to a decadent finish. Alc. 14% by vol.",Gary's Wayne,"1308 NJ-23, Wayne, NJ 07470, USA"
Chateau Saint Michelle Indian Wells Red Blend,United States,Columbia Valley,Washington,"Syrah, Merlot",17.99,,Gary's Wayne,"1308 NJ-23, Wayne, NJ 07470, USA"
Chateau Saint Michelle Sauvignon Blanc Horse Heaven Hills,United States,Columbia Valley,Washington,Sauvignon Blanc,12.99,,Gary's Wayne,"1308 NJ-23, Wayne, NJ 07470, USA"
Chateau Saint Roseline Lampe De Meduse Provence Rose,France,Cotes De Provence,Provence,Rose,18.99,,Gary's Wayne,"1308 NJ-23, Wayne, NJ 07470, USA"
Chateau Saint Sulpice,France,Bordeaux,Bordeaux,"Merlot, Cabernet Sauvignon, Cabernet Franc",11.99,,Gary's Wayne,"1308 NJ-23, Wayne, NJ 07470, USA"
Chateau Saintayme Saint Emilion Grand Cru,France,Bordeaux,NA,NA,19.99,,Gary's Wayne,"1308 NJ-23, Wayne, NJ 07470, USA"
Chateau Smith Haut Lafitte Rouge,France,Pessac Leognan,Bordeaux,"Cabernet Sauvignon, Merlot, Cabernet Franc, Petit Verdot",85.99,"The style of our red wine is very classic, with a neat expression of our terrior of Gnzian Gravels, which gives the wine some unique smoky notes. We look for elegance and structure, freshness and complexity, balance and richness. The majority of Cabernet Sauvignon grown in our vineyard, harvested at full maturity and vinified in the softest way to only extract the silkiest tannins, unveils after a few years all its potential, which we can then enjoy during long years. The other varietals grown on the estate add to the Cabernet Sauvignon their own flavors and take part to the typical harmony of our Cru Classe de Graves.",Gary's Wayne,"1308 NJ-23, Wayne, NJ 07470, USA"
