name,country,region,state,varietal,price,description,merchant,address
Moet & Chandon Ice Imperial Champagne,France,Champagne,NA,"Sparkling, Champagne",64.99,"Moët & Chandon is the champagne of success and glamour since 1743. Renowned for its achievements and legendary pioneering spirit, Moët & Chandon is synonymous with both cherished traditions and modern pleasures and has helped celebrate life’s most triumphant moments for more than 270 years.

Faithful to this spirit, Moët & Chandon has revolutionized the world of Champagne with a breakthrough creation, Moët Ice Impérial, the first champagne created to be served on ice cubes.

Moët Ice Impérial, served with 3 ice cubes in a large cabernet-style glass, can be mixed with ingredients that heighten its freshness and aromatic intensity:

- Mint leaves
- Lime or white grapefruit zest
- Cucumber peel
- A very thin slice of ginger
- Red fruits (strawberries, raspberries)

Color: A dense color: deep gold; with amber highlights.

Bouquet: An intense, fruity bouquet: the powerful aroma of tropical fruits (mango, guava); the sumptuousness of stone fruits (nectarine); an original note of raspberry.

Palate: A generous palate combining roundness and freshness: the broad, fleshy, voluptuous flavor of a fresh fruit salad; the captivating sweetness of caramel and quince jelly; the refreshing acidity of grapefruit and ginger notes.
",Gary's Wayne,"1308 NJ-23, Wayne, NJ 07470, USA"
Monte Antico Toscana,Italy,NA,Tuscany,"Sangiovese, Cabernet Sauvignon, Merlot",9.99,,Gary's Wayne,"1308 NJ-23, Wayne, NJ 07470, USA"
Montecillo Rioja Gran Reserve Crianza Tempranillo,Spain,Rioja,NA,Tempranillo,31.99,"Intense ruby red in color, this wine offers strong aromas of ripe fruit. On the palate, it is complex and elegant -- showing a satin texture with fine tannins and flavors of leather. The long finish offers notes of licorice.

Ideal with any type of meat, especially game. It is a very elegant wine, which enhances stews and dishes with fatty fish like salmon and tuna.

Bodegas Montecillo was founded by Celestino Navajas in 1874 in the town of Fuenmayor in Spain's Rioja Alta region, the major and most traditional winemaking region in Spain. Thanks to the expertise that his son Alejandro acquired in France, the bodega was one of the first to adapt Bordeaux winemaking techniques to Spanish grapes, earning the reputation and prestige that it still enjoys today.

In 1973, Bodegas Montecillo was acquired by Osborne y Cía. Osborne has continued the unique quality and traditions of the winery, including aging the wines exclusively in French oak barrels, which are handmade at the winery's own cooperage, and the use of 100% Tempranillo grapes for its red wines. Montecillo also boasts one of the most well-known female winemakers in Spain, Maria Martinez Sierra, who consistently produces fine wines year after year.",Gary's Wayne,"1308 NJ-23, Wayne, NJ 07470, USA"
Montecillo Rioja Reserva,Spain,Rioja,NA,Tempranillo,14.99,,Gary's Wayne,"1308 NJ-23, Wayne, NJ 07470, USA"
Moët & Chandon Impérial Brut Champagne,France,Champagne,Champagne,"Sparkling, Champagne",11.99,"Moët & Chandon is the champagne of success and glamour since 1743. Renowned for its achievements and legendary pioneering spirit, Moët & Chandon is synonymous with both cherished traditions and modern pleasures and has helped celebrate life’s most triumphant moments for more than 270 years.

Moët Impérial is the House's iconic champagne. Created in 1869, it embodies the unique Moët & Chandon style; a style that distinguishes itself by its bright fruitiness, seductive palate, and elegant maturity. 

Color: Golden straw yellow with green highlights

Bouquet: Vibrant intensity of green apple and citrus fruit; fresh mineral nuances and white flowers; elegant blonde notes of brioche and fresh nuts. 

Palate: Fresh white-fleshed fruits (pear, peach, apple) and vibrant citrus fruit brought to life with fine, lively bubbles and a bright finish. 
",Gary's Wayne,"1308 NJ-23, Wayne, NJ 07470, USA"
Moët & Chandon Nectar Imperial Rosé Champagne,France,Champagne,NA,"Champagne, Sparkling, Pinot Noir, Pinot Meunier, Chardonnay, Demi Sec",64.99,"Moët & Chandon is the champagne of success and glamour since 1743. Renowned for its achievements and legendary pioneering spirit, Moët & Chandon is synonymous with both cherished traditions and modern pleasures and has helped celebrate life’s most triumphant moments for more than 270 years.

Nectar Impérial Rosé is an intense and voluptuous expression of the Moët & Chandon style, with aromas of red and black currants made even richer by notes of caramel, nutmeg and wild strawberry.

Nectar Impérial Rosé pairs perfectly with sweet, sweet and salty, and sweet and sour flavors:

- Foie gras marinated in red wine
- Truffle popcorn
- Curry dishes
- Desserts made with berries

Color: Bright pink; with intense coppery highlights.

Bouquet: Intense fruitiness of ripe berries like wild strawberry, redcurrant and blackcurrant are heightened by powerful notes of ripe peach and a delectable nuance of strawberry jam.

Palate:  Richness and freshness balance together, with the persistent intensity of ripe berries warmed by sensual nutmeg and caramel, finishing with a fresh hit of redcurrant.
",Gary's Wayne,"1308 NJ-23, Wayne, NJ 07470, USA"
Mud House Sauvignon Blanc,New Zealand,Marlborough,NA,Sauvignon Blanc,10.99,,Gary's Wayne,"1308 NJ-23, Wayne, NJ 07470, USA"
Mulderbosch Faithful Hound Bordeaux Blend,South Africa,Stellenbosch,Western Cape,"Cabernet Franc, Cabernet Sauvignon, Merlot, Malbec, Petit Verdot",18.99,"Despite the poignant raison d’etre for this wine, the Mulderbosch Faithful Hound celebrates the virtues of Bordeaux’s great tradition of blending by being one of the first 5 varietal blends in the Cape. Aside from investing considerable effort in our own vineyards in close proximity to False Bay, our quest to find the perfect terroirs for each variety used in the blend leads us from the cool mountain plateau of Elgin to the rich, shale soils of Bottelary, and many places in between. The goal with each bottling of Faithful Hound is to produce a rich, complex wine that comfortably expresses old world class and the generosity of fruit associated with the Cape. - See more at: http://www.mulderbosch.com/our-wines/faithful-hound#sthash.0iwGS6rR.dpuf",Gary's Wayne,"1308 NJ-23, Wayne, NJ 07470, USA"
Murrieta's Well The Spur Red Blend,United States,Livermore Valley,California,"Petite Sirah, Petit Verdot, Cabernet Franc, Malbec",19.99,"The Spur 2018 is crafted from blending the classic Bordeaux varietals with Petite Sirah, which offers a distinctively California expression. Each varietal is farmed, harvested, and handcrafted individually to achieve their greatest expression prior to assembling the final blend. The 2018 vintage provides an aromatic profile of black cherry, blueberry and clove with complementary notes of graham cracker and ripe blackberry. The dark fruit aromas carry through to the palate which is framed by fine tannins, and a rich, lasting, and elegant mouthfeel. Enjoy through 2026.",Gary's Wayne,"1308 NJ-23, Wayne, NJ 07470, USA"
Nando Asti Sparking Wine,Italy,Moscato D'asti,Piedmont,Moscato,9.99,,Gary's Wayne,"1308 NJ-23, Wayne, NJ 07470, USA"
Nando Marsala Dry,Italy,Marsala,Sicily,Grillo,6.99,"Ruby red with amber overtones, posesing a  dry and sweet flavor with over ripe flavors of dry fruits. Perfect for making your favorite dishes!",Gary's Wayne,"1308 NJ-23, Wayne, NJ 07470, USA"
Nickel & Nickel Cabernet Sauvignon C C Ranch Rutherford,United States,Napa Valley,California,Cabernet Sauvignon,99.99,"C.C. Ranch Cabernet Sauvignon offers gorgeous raspberry and black cherry aromas, leading to a bright palate of cherry flavors melded with chocolate, floral notes and a hint of Rutherford dust. The velvety, coating tannins are in perfect harmony with the fruit. Richness persists from the entry to the seductive, lingering finish.",Gary's Wayne,"1308 NJ-23, Wayne, NJ 07470, USA"
Noble Vines 181 Merlot,United States,Lodi,California,Merlot,10.99,"181 is classic Merlot, offering softer tannins than Cabernet Sauvignon, but equal elegance and concentration. It opens with aromas of black cherry, vanilla and toasty spice. Fresh fruit flavors of currant and cherry mingle gently with spicy cedar and vanilla. The wine is supple in texture, full bodied, long and well-balanced on the palate, with a lingering finish.
With a gentle balance of tannin's and acidity, it is the perfect companion to pasta with sausage and roasted peppers or a pan seared steak with mushrooms and parsley.",Gary's Wayne,"1308 NJ-23, Wayne, NJ 07470, USA"
Noble Vines 337 Cabernet Sauvignon,United States,Lodi,California,Cabernet Sauvignon,11.99,"337 Cabernet Sauvignon exudes vibrant aromas of black cherry, ripe currant, fresh herbs and lightly roasted coffee. Smooth tannins and balanced acidity support core flavors of blackberry, black cherry and chocolate, intertwined with spicy black pepper accents on the finish. This wine can be enjoyed on its own or with herb-roasted pork loin, baked chicken or barbecued steak and sauteed mushrooms.",Gary's Wayne,"1308 NJ-23, Wayne, NJ 07470, USA"
Noble Vines 667 Pinot Noir,United States,Monterey County,California,Pinot Noir,11.99,"Noble Vines 667 Pinot Noir exhibits appealing aromas of black cherry, plum and a hint of bittersweet cocoa powder. Plush tannins and balanced acidity support core flavors of ripe Bing cherry, juicy plum and delicate hints of soft, toasty oak. The pedigree of the grapes makes 667 an appropriate wine for dinner parties, to be enjoyed on its own or with nearly any cuisine, particularly salmon, roast lamb, or salads with cheeses or nuts.",Gary's Wayne,"1308 NJ-23, Wayne, NJ 07470, USA"
Noel & Jean Luc Raimbault Sancerre,France,Sancerre,Loire Valley,Sauvignon Blanc,21.99,,Gary's Wayne,"1308 NJ-23, Wayne, NJ 07470, USA"
Olivier Leflaive Bourgogne Blanc Les Setilles,France,Bourgogne,Burgundy,Chardonnay,21.99,,Gary's Wayne,"1308 NJ-23, Wayne, NJ 07470, USA"
Orin Swift Machete,United States,Napa Valley,California,"Petite Sirah, Syrah, Grenache",47.99,,Gary's Wayne,"1308 NJ-23, Wayne, NJ 07470, USA"
Ornellaia Le Volte Dell'Ornellaia,Italy,Tuscany,NA,"Merlot, Cabernet Sauvignon, Sangiovese",25.99,"Le Volte dell’Ornellaia combines a Mediterranean expression of generosity with structure and complexity, reflecting the philosophy of Ornellaia. Le Volte dell’Ornellaia is a fine wine for spontaneous wine lovers and needs no ceremony.",Gary's Wayne,"1308 NJ-23, Wayne, NJ 07470, USA"
Oyster Bay Sauvignon Blanc,New Zealand,Marlborough,NA,Sauvignon Blanc,12.99,"The philosophy of Oyster Bay is to produce fine, distinctively regional wines that are elegant and assertive with glorious fruit flavors. Oyster Bay Sauvignon Blanc is the wine that started it all. Which happened to win the best Sauvignon Blanc in the world. Its brilliant clarity, extraordinary aromatic flavors and refreshing zest are both thrilling and enthralling. Oyster Bay Sauvignon Blanc features enticing citrus notes and tropical flavors – youthful, elegant, and fresh with a lingering, zesty finish.

Oyster Bay Marlborough Sauvignon Blanc is ideal as an aperitif or perfectly matched with raw and grilled seafood such as salmon and tuna, calamari, crab cakes, Cajun and spicy dishes, and fresh Asian flavors.",Gary's Wayne,"1308 NJ-23, Wayne, NJ 07470, USA"
Pacific Rim Riesling,United States,Columbia Valley,Washington,Riesling,9.99,"Pale gold in color. Aromas of honey, pear and orange blossom. Sweet on the palate, bright acidity with pineapple and white peach.

Ideal with fiery fare – especially Thai, Szechwan, Mexican, Middle Eastern and Caribbean cuisine.",Gary's Wayne,"1308 NJ-23, Wayne, NJ 07470, USA"
Pascual Toso Reserva Cabernet Sauvignon,Argentina,Mendoza,NA,Cabernet Sauvignon,19.99,"Elegant style, with lovely boysenberry and raspberry fruit. Plenty of vanilla, spice and chocolate shavings too. Lengthy, focused finish. Elegant and complex wine. Very sweet, but consistent tannins. 
Enjoy it with pasta, red meats, lamb, Italian pasta or French cheese.",Gary's Wayne,"1308 NJ-23, Wayne, NJ 07470, USA"
Paul Cheneau Lady Of Spain Cava Brut,Spain,Cava,NA,"Champagne, Sparkling, Macabeo, Parellada, Cava",9.99,,Gary's Wayne,"1308 NJ-23, Wayne, NJ 07470, USA"
Paul Jaboulet Cornas Les Grands Terrasses,France,Cornas,Northern Rhone,Syrah,34.99,"Simple color, the nose is concentrated powerful and rich. There are notes of black fruits and spices. On the palate, this powerful wine with a beautiful tannin structure shows aromas of garrigue and red fruits with licorice, lingering and dense finish.
Pairs well with jugged hare with fresh pasta and veal kidneys with marrow.",Gary's Wayne,"1308 NJ-23, Wayne, NJ 07470, USA"
Paul Nicolle Chablis,France,Chablis,Burgundy,Chardonnay,24.99,,Gary's Wayne,"1308 NJ-23, Wayne, NJ 07470, USA"
Penfolds Koonunga Hill Shiraz Cabernet,Australia,NA,South Australia,"Cabernet Sauvignon, Shiraz",9.99,,Gary's Wayne,"1308 NJ-23, Wayne, NJ 07470, USA"
Perrier Jouet Grand Brut Champagne,France,Champagne,NA,"Sparkling, Champagne",46.99,,Gary's Wayne,"1308 NJ-23, Wayne, NJ 07470, USA"
Peter Michael Les Pavots Cabernet Sauvignon,United States,Knights Valley,California,Cabernet Sauvignon,199.99,"Peter Michael's Les Pavots is very special indeed in 2017. Galloni called it ""utterly captivating from the first taste. A rush of blackberry, crushed rocks, graphite, rose petal, mint, lavender and blue/purplish fruit builds in the glass. All the pedigree of Knights Valley is on display."" Look for this one to age 15-20 years in your cool cellar with no problem.",Gary's Wayne,"1308 NJ-23, Wayne, NJ 07470, USA"
Pewsey Vale Eden Valley Dry Riesling,Australia,Eden Valley,South Australia,Riesling,12.99,"This wine is a classic example of dry Eden Valley Riesling, showing the flavours we see so consistently each year from this wonderful single vineyard. This wine shows intense aromas of talcum and lemon lime fruit, with a fine floral perfume overlaying dried herb. The palate shows great length and depth with limes, white flowers and fresh rosemary. The wine finishes with a fresh natural acidity, which balances the flavour intensity, and a minerality that will reward medium to long-term cellaring",Gary's Wayne,"1308 NJ-23, Wayne, NJ 07470, USA"
Pietranera Brunello Di Montalcino,Italy,Brunello Di Montalcino,Tuscany,Sangiovese,39.99,Intense ruby red in color. On the nose it presents a wide range of aromas with hints of fruit and spices along with nuances of cacao and chocolate. Supple tannins stand out in the elegant and long finish.,Gary's Wayne,"1308 NJ-23, Wayne, NJ 07470, USA"
Poggio Alla Guardia Maremma Toscana,Italy,Maremma,Tuscany,"Merlot, Cabernet Sauvignon, Sangiovese",16.99,"Deep ruby red color. The nose is intense with aromas of dark plums, chocolate, spices and grilled herbs.  Clean mineral notes frame the finish and confer an attractive element of freshness.",Gary's Wayne,"1308 NJ-23, Wayne, NJ 07470, USA"
Poggiotondo Brunello Di Montalcino,Italy,Brunello Di Montalcino,Tuscany,Sangiovese,34.99,Ruby to garnet red in color with a bouquet of dried violets and leather. Intense flavors of black cherry and tobacco with a complex and lasting finish.,Gary's Wayne,"1308 NJ-23, Wayne, NJ 07470, USA"
Pol Roger Brut Reserve Champagne,France,Champagne,NA,"Pinot Noir, Chardonnay, Pinot Munier",39.99,"Established in 1849, Pol Roger is one of the few luxury Champagne producers that remains family-owned. Critically acclaimed, staunchly supported by Winston Churchill and even served at William & Kate's wedding.

The Brut Non Vintage blend is traditionally composed from about 30 to 35 still base wines, drawn from different vineyard sites and vintage years. Reserve wines compose between 20-30% of the traditional blend. On the palate, this medium-bodied Brut is as round and fruit-driven as it is delicate, pure and very elegant. The mousse is deliciously fine and leads to a long, steely, dry and slightly minerally, long finish.
95 Points James Halliday",Gary's Wayne,"1308 NJ-23, Wayne, NJ 07470, USA"
Provenance Vineyards Rutherford Sauvignon Blanc,United States,Napa Valley,California,Sauvignon Blanc,17.99,"WINE ADVOCATE 90 POINTS

""The 2016 Sauvignon Blanc Estate delivers intense guava, green mango and lemon curd notes with hints of peach blossoms and wild thyme. Medium bodied, the palate contributes a savory/yeasty dimension, toning down the otherwise exuberant tropical flavors and finishing long with lovely harmony.
Lisa Perrotti-Brown, Wine Advocate",Gary's Wayne,"1308 NJ-23, Wayne, NJ 07470, USA"
Quilt Cabernet Sauvignon Napa Valley,United States,Napa Valley,California,Cabernet Sauvignon,44.99,"Joe Wagner, of Caymus fame, has released his fruit-driven, private label Cabernet. If you like Caymus, you will be wowed. Makes an excellent gift.

Bright and lively, with a light bramble note weaving in among the raspberry, plum and blackberry compote flavors as toast and licorice hints check in. The brambly element keeps this energetic through the finish. Drink now through 2022.",Gary's Wayne,"1308 NJ-23, Wayne, NJ 07470, USA"
Raeburn Russian River Valley Chardonnay,United States,Russian River Valley,California,Chardonnay,14.99,"REGION: Russian River Valley/California

VARIETAL: Chardonnay

NOTES: Oaky nose over a core of grapefruit, lemon curd and ginger nut notes. Medium-bodied with pleasant freshness supporting the uncomplicated citrus flavors, it finishes tangy. 

FOOD PAIRING: Fish & Chips",Gary's Wayne,"1308 NJ-23, Wayne, NJ 07470, USA"
Ravel And Stitch Cabernet Sauvignon 416r,United States,Central Coast,California,"Cabernet Sauvignon, Petite Sirah, Merlot, Petit Verdot, Malbec",19.99,,Gary's Wayne,"1308 NJ-23, Wayne, NJ 07470, USA"
Ravenswood Vintner's Blend Cabernet Sauvignon,United States,NA,California,Cabernet Sauvignon,8.99,,Gary's Wayne,"1308 NJ-23, Wayne, NJ 07470, USA"
Relax Riesling,Germany,NA,Mosel Saar Ruwer,Riesling,9.99,"This fine Riesling wine originates from the Mosel valley with its steep vineyards and offers an extraordinary premium wine quality. Forward fruit and floral aromas of apples and peaches with just a hint of citrus. The natural acidity gives the wine a perfect balance that is refreshingly crisp and leaves your mouth watering. This wine pairs well with a wide range of food like light salads, poultry, seafood  and blue cheese or just on its own. Serve chilled.",Gary's Wayne,"1308 NJ-23, Wayne, NJ 07470, USA"
Ridge East Bench Zinfandel Dry Creek Valley,United States,Sonoma County,California,"Zinfandel, Syrah, Cabernet Sauvignon",28.99,,Gary's Wayne,"1308 NJ-23, Wayne, NJ 07470, USA"
Ridge Vineyards Zinfandel Pagani Ranch,United States,Sonoma County,California,"Zinfandel, Petite Sirah, Syrah, Mourvedre",34.99,,Gary's Wayne,"1308 NJ-23, Wayne, NJ 07470, USA"
Robert Craig Howell Mountain Cuvee,United States,Napa Valley,California,"Cabernet Sauvignon, Merlot, Malbec",34.99,"2018 was a tremendous vintage in the Napa Valley and this new red wine cuveé shows all of the deep color, structure and complexity that one might expect from Howell Mountain.",Gary's Wayne,"1308 NJ-23, Wayne, NJ 07470, USA"
Robert Mondavi Private Selection Bourbon Barrel Aged Cabernet Sauvignon,United States,NA,California,Cabernet Sauvignon,12.99,"Robert Mondavi Private Selection Bourbon Barrel Aged Cabernet Sauvignon Red Wine is a complex and decadent cabernet wine that leaps from the glass with aromas of blackberry cobbler, graham cracker, brown sugar, milk chocolate, coffee and smoke. Made with grapes selected at the peak of ripeness from coastal vineyards in Monterey County, this bold California red wine offers flavorful notes of blueberry pie, praline, sweet vanilla custard, caramel and mocha. Taking a truly original approach to barrel aging, portions of this wine are aged in new and old bourbon barrels, giving it deep toasted oak undertones, with notes of vanilla and dried herbs. Awarded Double Gold at the 2017 San Francisco International Wine Competition, this cabernet sauvignon wine is framed by soft, chewy tannins and a lingering finish that makes it a natural companion to pesto parm pastry straws or bourbon glazed ribs and a fitting part of a wine and cheese platter. Store at room temperature, then refrigerate for 30 minutes before serving. Please enjoy our wines responsibly. © 2020 Robert Mondavi, Acampo, CA USA",Gary's Wayne,"1308 NJ-23, Wayne, NJ 07470, USA"
Robert Mondavi Private Selection Heritage Red Blend,United States,Central Coast,California,Red Blend,8.99,"Robert Mondavi Private Selection Heritage Red Wine showcases flavors of ripe raspberry, cherry and chocolate and decadent aromas of strawberry and vanilla that pair perfectly with spicy dishes.",Gary's Wayne,"1308 NJ-23, Wayne, NJ 07470, USA"
Robert Mondavi Winery Cabernet Sauvignon,United States,Napa Valley,California,"Cabernet Sauvignon, Petit Verdot, Cabernet Franc",29.99,"Robert Mondavi Winery Napa Valley Cabernet Sauvignon Red Wine delivers mouth filling, deeply intense blackberry fruit flavor across the palate, with aromas of clove, cardamom and vanilla spice. Dusty tannins add structure to the juicy fullness of the fruit, followed by a lingering, velvety finish. Fruit for this Napa Valley wine is sourced from two of the valley's most renowned sub-appellations: Oakville and Stag's Leap district. The fruit is combined with other grapes from a number of the area's finest vineyards, creating a cabernet sauvignon wine that is the perfect expression of the region. This Robert Mondavi red wine undergoes 24 days of wine to grape skin contact, to maximize the extraction of varietal character while keeping the tannins fleshy and supple. Pair a glass of this delicious red wine with your favorite beef, steak, lamb or pasta dishes. For optimal taste, store this bottle of wine at room temperature, but refrigerate for about 30 to 60 minutes before pouring a glass. Please enjoy our wines responsibly. © 2020 Robert Mondavi, Acampo, CA USA.",Gary's Wayne,"1308 NJ-23, Wayne, NJ 07470, USA"
Rodney Strong Cabernet Sauvignon,United States,Sonoma County,California,Cabernet Sauvignon,17.99,"Rich with dark cherries, plum, spices, and black pepper. The palate is full with medium tannins and a lush finish.",Gary's Wayne,"1308 NJ-23, Wayne, NJ 07470, USA"
Roederer Estate Brut,United States,Anderson Valley,California,"Sparkling, Champagne",14.99,"A voluptuous and expressive sparkler, with floral red apple, brioche and cinnamon spice aromas and rich, vibrant flavors that finish on a luxurious note. #25 Wine Spectator Top 100 of 2017",Gary's Wayne,"1308 NJ-23, Wayne, NJ 07470, USA"
Round Pond Sauvignon Blanc,United States,Napa Valley,California,Sauvignon Blanc,19.99,"The aromatics of this warm-weather sipper are bright, playful and tropical, teasing the taste buds with a bouquet of papaya, mango, and honeydew melon. The wine dances across the palate delivering everything promised by the bouquet including layers of white peach, ripe pear, granny smith apples, and candied grapefruit. As you enjoy this wine, it continues to evolve beautifully, finishing with silky tones and refreshing minerality; notes of lime zest, mandarin orange, and limestone linger delightfully for minutes.

PRODUCTION NOTES: All stainless, no malolactic.",Gary's Wayne,"1308 NJ-23, Wayne, NJ 07470, USA"
RouteStock Pinot Noir,United States,Sonoma Coast,California,Pinot Noir,19.99,"The nose jumps right out of the glass with classic Pinot Noir aromas of strawberry, shiitake mushrooms, bay laurel and soy. The savory characters of the aroma go straight to the pallet with an amazing combination of that savory and the sweet red fruit characters. There is just enough very high-quality French oak to weave these two amazing characters together. The beautiful silky texture of the wine makes a mouthfeel that is at first expansive and then bright, crisp and inviting you back for another sip. A long lingering aftertaste is highlighted by orange peel, rosemary and toasted hazelnuts.",Gary's Wayne,"1308 NJ-23, Wayne, NJ 07470, USA"
"Ruffino Chianti Classico Riserva ""Ducale Oro"" Gran Selezione",Italy,Chianti Classico,Tuscany,Sangiovese,34.99,"Ruffino Riserva Ducale Oro Gran Selezione Chianti Classico DOCG Red Wine is an elegant and well-structured red wine blend that expresses a distinctive Tuscan bouquet of violet, cherry and plum, with scents of chocolate and spice. Made with meticulously hand-harvested chianti, merlot and colorino grapes from Ruffino's acclaimed Gretole and Santedame estates in the Castellina sub-region of Chianti Classico, this Italian red wine offers powerfully fruity flavors with intriguing notes of cinnamon and clove. This red blend ages in oak, stainless steel and concrete vats for 36 months, followed by additional months in the bottle before release, resulting in a full-bodied chianti wine with elegant tannins, good acidity and a lasting finish with hints of chocolate and coffee. Enjoy this fine wine with traditional Italian dishes such as pasta with bolognese sauce, wild boar ragu or eggplant parmesan. It also pairs well with classic American dishes such as grilled rib eye and roasted vegetables. Please enjoy our wines responsibly. © 2020 Ruffino Import Company, Rutherford, CA USA",Gary's Wayne,"1308 NJ-23, Wayne, NJ 07470, USA"
"Ruffino Chianti Classico Riserva ""Ducale""",Italy,Chianti,Tuscany,Sangiovese,19.99,"Color: Intense ruby red.

Aroma: This complex wine is characterized by cherry and violet notes with delicate hints of tobacco, white pepper, and a touch of flint.

Tasting profile: Chianti Classico Riserva Ducale is well balanced on the palate, with velvety tannins, firm acidity, and a lingering finish of rosemary. Its structure will allow it to age for two to five years, if not longer.",Gary's Wayne,"1308 NJ-23, Wayne, NJ 07470, USA"
